{
    "IssueDate": "1910-05-19",
    "Meetings": [
        {
            "Date": "MAY 19",
            "Location": "Dublin - 35, Molesworth Street",
            "Raw": "MAY 19\nDublin - 35, Molesworth Street - Committee Meeting."
        },
        {
            "Date": "MAY 19",
            "Location": "Leamington - 44, Avenue Road",
            "Raw": "MAY 19\nLeamington - 44, Avenue Road - Miss Harrison's Drawing-room Meeting - Mrs. Julian Osler.",
            "Description": "Miss Harrison's Drawing-room Meeting",
            "Hosts": [
                "Miss Harrison"
            ],
            "Speakers": [
                "Mrs. Julian Osler"
            ]
        },
        {
            "Date": "MAY 19",
            "Location": "Watford - Masonic Hall",
            "Raw": "MAY 19\nWatford - Masonic Hall - Mr. J. Malcolm Mitchell.",
            "Speakers": [
                "Mr. J. Malcolm Mitchell"
            ]
        },
        {
            "Date": "MAY 19",
            "Location": "London (Highgate) - Outside Tufnell Park Tube Station",
            "Raw": "MAY 19\nLondon (Highgate) - Outside Tufnell Park Tube Station - Miss Ransom.",
            "Speakers": [
                "Miss Ransom"
            ]
        },
        {
            "Date": "MAY 23",
            "Location": "London (Epsom)",
            "Raw": "MAY 23\nLondon (Epsom) - Open-air Meeting - Mrs. Rackham.",
            "Speakers": [
                "Mrs. Rackham"
            ]
        },
        {
            "Date": "MAY 23",
            "Location": "London (Sutton)",
            "Raw": "MAY 23\nLondon (Sutton) - Drawing-room Meeting - Mrs. Rackham.",
            "Speakers": [
                "Mrs. Rackham"
            ]
        },
        {
            "Date": "MAY 24",
            "Location": "Leatherhead - Public Hall",
            "Raw": "MAY 24\nLeatherhead - Public Hall - Mrs. Fawcett.",
            "Speakers": [
                "Mrs. Fawcett"
            ]
        },
        {
            "Date": "MAY 24",
            "Location": "Cambridge - Barton Schoolroom",
            "Raw": "MAY 24\nCambridge - Barton Schoolroom - Mrs. Ramsey, Mrs. Rackham.",
            "Speakers": [
                "Mrs. Ramsey",
                "Mrs. Rackham"
            ]
        },
        {
            "Date": "MAY 24",
            "Location": "Newark - Assembly Rooms",
            "Raw": "MAY 24\nNewark Assembly Rooms - Mrs. W. E. Dowson.",
            "Speakers": [
                "Mrs. W. E. Dowson"
            ]
        },
        {
            "Date": "MAY 24",
            "Location": "Bournemouth - Assembly Rooms",
            "Raw": "MAY 24\nBournemouth - Assembly Rooms - At Home - Miss Hudson - Suffrage Play.",
            "Description": "At Home - Suffrage Play",
            "Speakers": [
                "Miss Hudson"
            ]
        },
        {
            "Date": "MAY 25",
            "Location": "Darlington - Temperance Institute",
            "Raw": "MAY 25\nDarlington - Temperance Institute - Annual Meeting."
        },
        {
            "Date": "MAY 25",
            "Location": "London (Esher) - Village Hall",
            "Raw": "MAY 25\nLondon (Esher) - Village Hall - Mrs. Fawcett, Mr. Mitchell.",
            "Speakers": [
                "Mrs. Fawcett",
                "Mr. Mitchell"
            ]
        },
        {
            "Date": "MAY 25",
            "Location": "London (Enfield)",
            "Raw": "MAY 25\nLondon (Enfield) - Public Meeting - Miss M. Corbett.",
            "Speakers": [
                "Miss M. Corbett"
            ]
        },
        {
            "Date": "MAY 25",
            "Location": "London (Kensington)",
            "Raw": "MAY 25\nLondon (Kensington) - Miss Holland's Drawing-room Meeting.",
            "Hosts": [
                "Miss Holland"
            ]
        },
        {
            "Date": "MAY 25",
            "Location": "London (Surbiton)",
            "Raw": "MAY 25\nLondon (Surbiton) - Mrs. Meyer's Drawing-room Meeting - Miss Emily Davies, LL.D.",
            "Hosts": [
                "Mrs. Meyer"
            ],
            "Speakers": [
                "Miss Emily Davies, LL.D."
            ]
        },
        {
            "Date": "MAY 25",
            "Location": "Norwich",
            "Raw": "MAY 25\nNorwich - Annual Meeting - Mrs. Rackham.",
            "Speakers": [
                "Mrs. Rackham"
            ]
        },
        {
            "Date": "MAY 25",
            "Location": "Nottingham - 36, Bridlesmith Gate",
            "Raw": "MAY 25\nNottingham - 36, Bridlesmith Gate - At Home - Tea and Cocoa. 7-9",
            "Time": "7-9"
        }
    ],
    "RawTable": "Forthcoming Meetings\nMAY 19\nDublin - 35, Molesworth Street - Committee Meeting.\nLeamington - 44, Avenue Road - Miss Harrison's Drawing-room Meeting - Mrs. Julian Osler.\nWatford - Masonic Hall - Mr. J. Malcolm Mitchell.\nLondon (Highgate) - Outside Tufnell Park Tube Station - Miss Ransom.\nMAY 23\nLondon (Epsom) - Open-air Meeting - Mrs. Rackham.\nLondon (Sutton) - Drawing-room Meeting - Mrs. Rackham.\nMAY 24\nLeatherhead - Public Hall - Mrs. Fawcett.\nCambridge - Barton Schoolroom - Mrs. Ramsey, Mrs. Rackham.\nNewark Assembly Rooms - Mrs. W. E. Dowson.\nBournemouth - Assembly Rooms - At Home - Miss Hudson - Suffrage Play.\nMAY 25\nDarlington - Temperance Institute - Annual Meeting.\nLondon (Esher) - Village Hall - Mrs. Fawcett, Mr. Mitchell.\nLondon (Enfield) - Public Meeting - Miss M. Corbett.\nLondon (Kensington) - Miss Holland's Drawing-room Meeting.\nLondon (Surbiton) - Mrs. Meyer's Drawing-room Meeting - Miss Emily Davies, LL.D.\nNorwich - Annual Meeting - Mrs. Rackham.\nNottingham - 36, Bridlesmith Gate - At Home - Tea and Cocoa. 7-9",
    "TableSpan": [
        {
            "Column": 2,
            "Page": 11,
            "Scan": 7
        },
        {
            "Column": 1,
            "Page": 12,
            "Scan": 7
        }
    ]
}