{
    "IssueDate": "1910-06-02",
    "Meetings": [
        {
            "Date": "June 2",
            "Location": "London (S. Paddington), Mrs. Agnew's Drawing-room",
            "Raw": "London (S. Paddington) -Mrs . Agnew's Drawing - room Meeting- Miss C. Black . 4.0",
            "Speakers": [
                "Miss C. Black"
            ],
            "Time": "4.0"
        },
        {
            "Date": "June 2",
            "Location": "Cranleigh Village Hall",
            "Raw": "Cranleigh Village Hall - Miss Abadam .",
            "Speakers": [
                "Miss Abadam"
            ]
        },
        {
            "Date": "June 2",
            "Location": "Woking - Monument Hill Schools",
            "Raw": "Woking - Monument Hill Schools - Mrs . Basset . 8.0",
            "Speakers": [
                "Mrs. Basset"
            ],
            "Time": "8.0"
        },
        {
            "Date": "June 2",
            "Location": "Edinburgh - 40, Shandwick Place",
            "Raw": "Edinburgh - 40 , Shandwick Place - Sale . 11.0",
            "Description": "Sale",
            "Time": "11.0"
        },
        {
            "Date": "June 2",
            "Location": "London (Clapham) -Drawing-room",
            "Raw": "London (Clapham) -Drawing - room Meeting - Miss Cockle . 8.0",
            "Speakers": [
                "Miss Cockle"
            ],
            "Time": "8.0"
        },
        {
            "Date": "June 2",
            "Location": "London (Chelsea) -Chelsea Town Hall",
            "Raw": "London (Chelsea) -Chelsea Town Hall \" Press Cuttings \" and \" How the Vote was Won \" -Miss Eva Moore . 8.0",
            "Description": "\"Press Cuttings\" and \"How the Vote was Won\"",
            "Speakers": [
                "Miss Eva Moore"
            ],
            "Time": "8.0"
        },
        {
            "Date": "June 2",
            "Location": "Wallasey and Wirral - Port Sunlight",
            "Raw": "Wallasey and Wirral - Port Sunlight - Dinner - hour Meeting - Miss Rathbone . 12.30",
            "Description": "Dinner-hour Meeting",
            "Speakers": [
                "Miss Rathbone"
            ],
            "Time": "12.30"
        },
        {
            "Date": "June 2",
            "Location": "Eastbourne - Devonshire Park Theatre",
            "Raw": "Eastbourne - Devonshire Park Theatre - Miss Ellen Terry in \" A Pageant of Famous Women . \" 2.30",
            "Description": "A Pageant of Famous Women",
            "Speakers": [
                "Miss Ellen Terry"
            ],
            "Time": "2.30"
        },
        {
            "Date": "June 3",
            "Location": "Sheffield - Nether Lecture Room",
            "Raw": "Sheffield - Nether Lecture Room - Miss Margaret Hodge . 8.0",
            "Speakers": [
                "Miss Margaret Hodge"
            ],
            "Time": "8.0"
        },
        {
            "Date": "June 3",
            "Location": "Edinburgh - 40, Shandwick Place",
            "Raw": "Edinburgh - 40 , Shandwick Place - Meeting . 4.0",
            "Time": "4.0"
        },
        {
            "Date": "June 3",
            "Location": "Wilmslow - Mrs. Forrest Hewit's Drawing-room",
            "Raw": "Wilmslow - Mrs . Forrest Hewit's Drawing - room Meeting - Miss Robertson . 3.0",
            "Speakers": [
                "Miss Robertson"
            ],
            "Time": "3.0"
        },
        {
            "Date": "June 3",
            "Location": "Salford",
            "Raw": "Salford - Rally - Mrs . M\u00fcter Wilson .",
            "Description": "Rally",
            "Speakers": [
                "Mrs. M\u00fcter Wilson"
            ]
        },
        {
            "Date": "June 3",
            "Location": "Eastbourne - Devonshire Park",
            "Raw": "Eastbourne - Devonshire Park - Miss Ellen Terry in \" A Pageant of Famous Women . \" 2.30",
            "Description": "A Pageant of Famous Women",
            "Speakers": [
                "Miss Ellen Terry"
            ],
            "Time": "2.30"
        },
        {
            "Date": "June 4",
            "Location": "London (Camberwell) - Peckham Rye- Bandstand",
            "Raw": "London (Camberwell) -Open - air Demonstration - Peckham Rye- Bandstand - Mrs . Stanbury . 3.0",
            "Description": "Open-air Demonstration",
            "Speakers": [
                "Mrs. Stanbury"
            ],
            "Time": "3.0"
        },
        {
            "Date": "June 4",
            "Location": "London (Highgate and N. St. Pancras) -Highgate Hill, near Archway",
            "Raw": "London (Highgate and N. St. Pancras) -Highgate Hill , near Archway - Mrs . Garnett . 8.0",
            "Speakers": [
                "Mrs. Garnett"
            ],
            "Time": "8.0"
        },
        {
            "Date": "June 6",
            "Location": "Yateley - Drill Hall",
            "Raw": "Yateley - Drill Hall - Colonel Pennycuick , C.S.I. 3.0",
            "Speakers": [
                "Colonel Pennycuick, C.S.I"
            ],
            "Time": "3.0"
        },
        {
            "Date": "June 6",
            "Location": "London (Epsom)",
            "Raw": "London (Epsom) -Open - air Meeting . 8.0",
            "Description": "Open-air Meeting",
            "Time": "8.0"
        },
        {
            "Date": "June 7",
            "Location": "London (Richmond) - Mrs. Sandover's Drawing-room",
            "Raw": "London (Richmond) -Mrs . Sandover's Drawing - room Meeting- Miss Clementina Black on \" Sweating . \"",
            "Speakers": [
                "Miss Clementina Black"
            ],
            "Time": null
        }
    ],
    "RawTable": "Forthcoming Meetings\nJUNE 2 .\nLondon ( S. Paddington ) -Mrs . Agnew's Drawing - room Meeting- Miss C. Black . 4.0\nCranleigh Village Hall - Miss Abadam .\nWoking - Monument Hill Schools - Mrs . Basset . 8.0\nEdinburgh - 40 , Shandwick Place - Sale . 11.0\nLondon ( Clapham ) -Drawing - room Meeting - Miss Cockle . 8.0\nLondon ( Chelsea ) -Chelsea Town Hall \" Press Cuttings \" and \" How the Vote was Won \" -Miss Eva Moore . 8.0\nWallasey and Wirral - Port Sunlight - Dinner - hour Meeting - Miss Rathbone . 12.30\nEastbourne - Devonshire Park Theatre - Miss Ellen Terry in \" A Pageant of Famous Women . \" 2.30\nJUNE 3 .\nSheffield - Nether Lecture Room - Miss Margaret Hodge . 8.0\nEdinburgh - 40 , Shandwick Place - Meeting . 4.0\nWilmslow - Mrs . Forrest Hewit's Drawing - room Meeting - Miss Robertson . 3.0\nSalford - Rally - Mrs . M\u00fcter Wilson .\nEastbourne - Devonshire Park - Miss Ellen Terry in \" A Pageant of Famous Women . \" 2.30\nJUNE 4 .\nLondon ( Camberwell ) -Open - air Demonstration - Peckham Rye- Bandstand - Mrs . Stanbury . 3.0\nLondon ( Highgate and N. St. Pancras ) -Highgate Hill , near Archway - Mrs . Garnett . 8.0\nJUNE 6 .\nYateley - Drill Hall - Colonel Pennycuick , C.S.I. 3.0\nLondon ( Epsom ) -Open - air Meeting . 8.0\nJUNE 7 .\nLondon ( Richmond ) -Mrs . Sandover's Drawing - room Meeting- Miss Clementina Black on \" Sweating . \"",
    "TableSpan": [
        {
            "Column": 1,
            "Page": 15,
            "Scan": 9
        }
    ]
}