{
    "IssueDate": "1911-10-12",
    "Meetings": [
        {
            "Date": "October 12",
            "Location": "Liverpool - Deaf and Dumb Institute, Prince's Avenue",
            "Raw": "Liverpool - Deaf and Dumb Institute, Prince's Avenue - Meeting to consider formation of Association of Women Municipal Voters - Miss E. Rathbone, M.A., C.C., Miss U. Leadley Brown. 8-10",
            "Description": "Meeting to consider formation of Association of Women Municipal Voters",
            "Speakers": [
                "Miss E. Rathbone",
                "Miss U. Leadley Brown"
            ],
            "Time": "8-10"
        },
        {
            "Date": "October 12",
            "Location": "Guildford - The Village Hall - Albury",
            "Raw": "Guildford - The Village Hall - Albury - Miss E. Palliser, R. Bray, Esq. 8.0",
            "Speakers": [
                "Miss E. Palliser",
                "R. Bray, Esq"
            ],
            "Time": "8.0"
        },
        {
            "Date": "October 12",
            "Location": "Castleford Co-operative Guild",
            "Raw": "Castleford Co-operative Guild - Mrs. Parrish. 7.0",
            "Speakers": [
                "Mrs. Parrish"
            ],
            "Time": "7.0"
        },
        {
            "Date": "October 12",
            "Location": "Dunmow - The Vicarage",
            "Raw": "Dunmow - The Vicarage - Rev. C. Hinscliff, Rev. E. Evans (chair) 3.30",
            "Speakers": [
                "Rev. C. Hinscliff"
            ],
            "Time": "3.30"
        },
        {
            "Date": "October 12",
            "Location": "Whitchurch - Mrs. Price's Drawing-room",
            "Raw": "Whitchurch - Mrs. Price's Drawing-room Meeting - Miss Helen Fraser. 3.30",
            "Speakers": [
                "Miss Helen Fraser"
            ],
            "Time": "3.30"
        },
        {
            "Date": "October 13",
            "Location": "Liverpool - Deaf and Dumb Institute, Prince's Avenue",
            "Raw": "Liverpool - Deaf and Dumb Institute, Prince's Avenue - Meeting to consider formation of Association of Women Municipal Voters - Miss E. Chubb, Miss Johnson, and others. Chair, Mrs. Egerton Stewart - Brown. 8-10",
            "Description": "Meeting to consider formation of Association of Women Municipal Voters",
            "Speakers": [
                "Miss E. Chubb",
                "Miss Johnson"
            ],
            "Time": "8-10"
        },
        {
            "Date": "October 13",
            "Location": "Cardiff Albany Road Council School",
            "Raw": "Cardiff Albany Road Council School - Miss Helen Fraser. 8.0",
            "Speakers": [
                "Miss Helen Fraser"
            ],
            "Time": "8.0"
        },
        {
            "Date": "October 13",
            "Location": "Hitchin - Mr. and Mrs. Smithson's Drawing-room",
            "Raw": "Hitchin - Mr. and Mrs. Smithson's Drawing-room meeting - Miss K. D. Courtney. 3.45",
            "Speakers": [
                "Miss K. D. Courtney"
            ],
            "Time": "3.45"
        },
        {
            "Date": "October 13",
            "Location": "Manchester - Whalley Range - Mrs. Hiller's Drawing-room",
            "Raw": "Manchester - Whalley Range - Mrs. Hiller's Drawing-room meeting - Debate - Miss Ashton v. Miss C. Moir. 3.30",
            "Description": "Debate - Miss Ashton v. Miss C. Moir",
            "Time": "3.30"
        },
        {
            "Date": "October 13",
            "Location": "Manchester - Onward Buildings, Deansgate",
            "Raw": "Manchester - Onward Buildings, Deansgate - Meeting for Teachers - Miss Ashton and Miss J. F. Wood. 7.30",
            "Description": "Meeting for Teachers",
            "Speakers": [
                "Miss Ashton",
                "Miss J. F. Wood"
            ],
            "Time": "7.30"
        },
        {
            "Date": "October 13",
            "Location": "Rugby Queen Street Co-operative Hall, Regent Street",
            "Raw": "Rugby Queen Street Co-operative Hall, Regent Street- \"Open Question\" Society - Mrs. Ring. 7.30",
            "Description": "\"Open Question\" Society",
            "Speakers": [
                "Mrs. Ring"
            ],
            "Time": "7.30"
        },
        {
            "Date": "October 14",
            "Location": "Leigh Church Institute",
            "Raw": "Leigh Church Institute - P. W. Raffan, Esq., M.P., C. P. Scott, Esq., Miss E. Deakin, Miss M. Robertson. 7.30",
            "Speakers": [
                "P. W. Raffan, Esq., M.P",
                "C. P. Scott, Esq",
                "Miss E. Deakin",
                "Miss M. Robertson"
            ],
            "Time": "7.30"
        },
        {
            "Date": "October 14",
            "Location": "Chalk Hill, Watford, Miss Archer's and Miss Kindori's",
            "Raw": "W. Herts - Chalk Hill, Watford, Miss Archer's and Miss Kindori's Meeting for Elementary School Teachers - Mrs. Workman, Mr. Guggenheim. 3.0",
            "Description": "Meeting for Elementary School Teachers",
            "Speakers": [
                "Mrs. Workman",
                "Mr. Guggenheim"
            ],
            "Time": "3.0"
        }
    ],
    "RawTable": "Forthcoming Meetings\nOCTOBER 12. Liverpool - Deaf and Dumb Institute, Prince's Avenue - Meeting to consider formation of Association of Women Muni-\ncipal Voters - Miss E. Rathbone, M.A., C.C., Miss U. Leadley Brown. 8-10\nGuildford - The Village Hall - Albury - Miss E. Palliser, R. Bray, Esq. 8.0\nCastleford Co-operative Guild - Mrs. Parrish. 7.0\nDunmow - The Vicarage - Rev. C. Hinscliff, Rev. E. Evans (chair) 3.30\nWhitchurch - Mrs. Price's Drawing - room Meeting - Miss Helen Fraser. 3.30\nOCTOBER 13. Liverpool - Deaf and Dumb Institute, Prince's Avenue - Meeting to consider formation of Association of Women Muni-\ncipal Voters - Miss E. Chubb, Miss Johnson, and others. Chair, Mrs. Egerton Stewart - Brown. 8-10\nCardiff Albany Road Council School - Miss Helen Fraser. 8.0\nHitchin - Mr. and Mrs. Smithson's Drawing - room meeting - Miss K. D. Courtney. 3.45\nManchester - Whalley Range - Mrs. Hiller's Drawing - room meeting -Debate - Miss Ashton v. Miss C. Moir. 3.30\nManchester - Onward Buildings, Deansgate - Meeting for Teachers -Miss Ashton and Miss J. F. Wood. 7.30\nRugby Queen Street Co - operative Hall , Regent Street- \"Open Question\" Society - Mrs. Ring. 7.30\nOCTOBER 14. Leigh Church Institute - P. W. Raffan , Esq . , M.P. , C. P. Scott , Esq . , Miss E. Deakin , Miss M. Robertson . 7.30\nW. Herts - Chalk Hill , Watford , Miss Archer's and Miss Kindori's Meeting for Elementary School Teachers - Mrs. Workman , Mr. Guggenheim . 3.0",
    "TableSpan": [
        {
            "Column": 2,
            "Page": 11,
            "Scan": 6
        },
        {
            "Column": 1,
            "Page": 12,
            "Scan": 7
        },
        {
            "Column": 2,
            "Page": 12,
            "Scan": 7
        },
        {
            "Column": 1,
            "Page": 13,
            "Scan": 7
        }
    ]
}