{
    "IssueDate": "1912-02-22",
    "Meetings": [
        {
            "Date": "FEBRUARY 22",
            "Location": "Leamington Town Hall",
            "Raw": "Leamington Town Hall- \" A Reply to the Antis \" -Mrs . Cecil Chapman , J. Cameron Grant , Esq . , Lady Willoughby de Broke ( chair ) 8.0",
            "Speakers": [
                "Mrs. Cecil Chapman",
                "J. Cameron Grant",
                "Lady Willoughby de Broke"
            ],
            "Time": "8.0"
        },
        {
            "Date": "FEBRUARY 22",
            "Location": "Accrington - Town Hall",
            "Raw": "Accrington - Town Hall - Miss Ashton , The Lady Beatrice Kemp , Professor de Sumi- chrast 3.0",
            "Speakers": [
                "Miss Ashton",
                "The Lady Beatrice Kemp",
                "Professor de Sumichrast"
            ],
            "Time": "3.0"
        },
        {
            "Date": "FEBRUARY 22",
            "Location": "Oxford",
            "Raw": "Oxford - Mrs . Geldart's drawing - room meeting- Miss Helga Gill 8.0",
            "Speakers": [
                "Miss Helga Gill"
            ],
            "Time": "8.0"
        },
        {
            "Date": "FEBRUARY 22",
            "Location": "Burgess Hill- Central Sussex - Station Hall",
            "Raw": "Central Sussex - Station Hall , Burgess Hill- \" Why Women Want the Vote \" -Mrs . Dempster , Miss Chute Ellis ( chair ) 3.0",
            "Speakers": [
                "Mrs. Dempster",
                "Miss Chute Ellis"
            ],
            "Time": "3.0"
        },
        {
            "Date": "FEBRUARY 22",
            "Location": "Hayward's Heath - Liberal Club",
            "Raw": "Hayward's Heath - Liberal Club - Debate on Govern- ment Reform Bill - Mr . Eric Stevens , Miss Spooner 8.0",
            "Speakers": [
                "Mr. Eric Stevens",
                "Miss Spooner"
            ],
            "Time": "8.0"
        },
        {
            "Date": "FEBRUARY 22",
            "Location": "Bath",
            "Raw": "Bath Mrs. H. H. Johnston's drawing - room meeting -Miss A. Maude Royden 3.30",
            "Speakers": [
                "Miss A. Maude Royden"
            ],
            "Time": "3.30"
        },
        {
            "Date": "FEBRUARY 22",
            "Location": "Bath Assembly Rooms",
            "Raw": "Bath Assembly Rooms Men's meeting - Miss Maude Royden , Mr. W. C. H. Cross , The Archdeacon of Bath ( ohair ) 7.30",
            "Speakers": [
                "Miss Maude Royden",
                "Mr. W. C. H. Cross",
                "The Archdeacon of Bath"
            ],
            "Time": "7.30"
        },
        {
            "Date": "FEBRUARY 22",
            "Location": "Otley Mechanics ' Institute",
            "Raw": "Otley Mechanics ' Institute - Mrs . Philip Snowden , Mrs. Aldersley , Mrs. J. Maston ( chair ) 8.0",
            "Speakers": [
                "Mrs. Philip Snowden",
                "Mrs. Aldersley",
                "Mrs. J. Maston"
            ],
            "Time": "8.0"
        },
        {
            "Date": "FEBRUARY 22",
            "Location": "Walker - on - Tyne - Mechanics ' Hall",
            "Raw": "Walker - on - Tyne - Mechanics ' Hall - Miss 0 . Gordon , Miss Margaret Mein , Coun- cillor Dawson ( chair ) 7.30",
            "Speakers": [
                "Miss O. Gordon",
                "Miss Margaret Mein",
                "Councillor Dawson"
            ],
            "Time": "7.30"
        },
        {
            "Date": "FEBRUARY 22",
            "Location": "Coventry",
            "Raw": "Coventry - Mrs . Collington's drawing - room meeting -Mrs . Williams ( Nuneaton ) 8.0",
            "Speakers": [
                "Mrs. Williams"
            ],
            "Time": "8.0"
        },
        {
            "Date": "FEBRUARY 26",
            "Location": "Birkenhead - Neston Town Hall",
            "Raw": "Birkenhead - Neston Town Hall - Joint meeting with O.U.W.F.A. - Mrs . Sooresby Routledge , M.A. , Mrs. Duckworth , A. K. Bulley , Esq . , Lady Norman Hill ( chair ) 8.0",
            "Speakers": [
                "Mrs. Sooresby Routledge",
                "Mrs. Duckworth",
                "A. K. Bulley",
                "Lady Norman Hill"
            ],
            "Time": "8.0"
        },
        {
            "Date": "FEBRUARY 26",
            "Location": "Stevenage \" The Chestnuts \"",
            "Raw": "Stevenage \" The Chestnuts \" -Miss Eccles 3.30",
            "Speakers": [
                "Miss Eccles"
            ],
            "Time": "3.30"
        },
        {
            "Date": "FEBRUARY 26",
            "Location": "Monton St. Andrew's School",
            "Raw": "Monton St. Andrew's School- \" The Church League for Women's Suffrage \" -Miss A. Maude Royden 8.0",
            "Speakers": [
                "Miss A. Maude Royden"
            ],
            "Time": "8.0"
        },
        {
            "Date": "FEBRUARY 26",
            "Location": "Nottingham - Office , 54 , Long Row",
            "Raw": "Nottingham - Office , 54 , Long Row- \" At Home \" - \" Madam Roland \" -Mrs . Hickling 4-6",
            "Speakers": [
                "Mrs. Hickling"
            ],
            "Time": "4-6"
        },
        {
            "Date": "FEBRUARY 27",
            "Location": "Peterborough - The Grand Assembly Rooms",
            "Raw": "Peterborough - The Grand Assembly Rooms - Mrs . Fawcett , Miss I , O. Ford , the Dean of Peterborough ( chair ) 8.0",
            "Speakers": [
                "Mrs. Fawcett",
                "Miss I. O. Ford",
                "the Dean of Peterborough"
            ],
            "Time": "8.0"
        },
        {
            "Date": "FEBRUARY 27",
            "Location": "Limpsfield \" Stoneshill \"",
            "Raw": "\" Stoneshill \" annual meeting , hostess : Mrs. Osmaston . \" Women's service to the State , \" Miss Kate Hessel , Miss N. O'Shea ( chair ) 3.0",
            "Speakers": [
                "Mrs. Osmaston",
                "Miss Kate Hessel",
                "Miss N. O'Shea"
            ],
            "Time": "3.0"
        },
        {
            "Date": "FEBRUARY 27",
            "Location": "Wallasey and Wirrel - Heswall",
            "Raw": "Wallasey and Wirrel - Heswall - drawing - room meet- ing - Mrs . Scoresby Rontledge , M.A. , 0. Rohde , Esq . , ( chair ) 8.0",
            "Speakers": [
                "Mrs. Scoresby Routledge",
                "O. Rohde"
            ],
            "Time": "8.0"
        },
        {
            "Date": "FEBRUARY 27",
            "Location": "West Bromwich - Library Lecture Room",
            "Raw": "West Bromwich - Library Lecture Room - Mrs. Despard , Councillor J. Wheatley ( chair ) 8.0",
            "Speakers": [
                "Mrs. Despard",
                "Councillor J. Wheatley"
            ],
            "Time": "8.0"
        },
        {
            "Date": "FEBRUARY 27",
            "Location": "Eccles - Worsley Court House",
            "Raw": "Eccles - Worsley Court House \" Church League for The Women's Suffrage \" - The Lady Beatrice Kemp , Miss A. Maude Royden 8.0",
            "Speakers": [
                "The Lady Beatrice Kemp",
                "Miss A. Maude Royden"
            ],
            "Time": "8.0"
        },
        {
            "Date": "FEBRUARY 27",
            "Location": "Hassocks - Hassocks Hall",
            "Raw": "Hassocks - Hassocks Hall - The Lady Willoughby de Broke , T. A. Meates , Esq . , J.P. ( chair ) 7.30",
            "Speakers": [
                "The Lady Willoughby de Broke",
                "T. A. Meates"
            ],
            "Time": "7.30"
        }
    ],
    "RawTable": "Forthcoming Meetings\nFEBRUARY 22 .\nLeamington Town Hall- \" A Reply to the Antis \" -Mrs . Cecil Chapman , J. Cameron Grant , Esq . , Lady Willoughby de Broke ( chair ) 8.0\nAccrington - Town Hall - Miss Ashton , The Lady Beatrice Kemp , Professor de Sumi- chrast 3.0\nOxford - Mrs . Geldart's drawing - room meeting- Miss Helga Gill 8.0\nCentral Sussex - Station Hall , Burgess Hill- \" Why Women Want the Vote \" -Mrs . Dempster , Miss Chute Ellis ( chair ) 3.0\nHayward's Heath - Liberal Club - Debate on Govern- ment Reform Bill - Mr . Eric Stevens , Miss Spooner 8.0\nBath Mrs. H. H. Johnston's drawing - room meeting -Miss A. Maude Royden 3.30\nBath Assembly Rooms Men's meeting - Miss Maude Royden , Mr. W. C. H. Cross , The Archdeacon of Bath ( ohair ) 7.30\nOtley Mechanics ' Institute - Mrs . Philip Snowden , Mrs. Aldersley , Mrs. J. Maston ( chair ) 8.0\nWalker - on - Tyne - Mechanics ' Hall - Miss 0 . Gordon , Miss Margaret Mein , Coun- cillor Dawson ( chair ) 7.30\nCoventry - Mrs . Collington's drawing - room meeting -Mrs . Williams ( Nuneaton ) 8.0\nFEBRUARY 26 .\nBirkenhead - Neston Town Hall - Joint meeting with O.U.W.F.A. - Mrs . Sooresby Routledge , M.A. , Mrs. Duckworth , A. K. Bulley , Esq . , Lady Norman Hill ( chair ) 8.0\nStevenage \" The Chestnuts \" -Miss Eccles 3.30\nMonton St. Andrew's School- \" The Church League for Women's Suffrage \" -Miss A. Maude Royden 8.0\nNottingham - Office , 54 , Long Row- \" At Home \" - \" Madam Roland \" -Mrs . Hickling 4-6\nFEBRUARY 27 .\nPeterborough - The Grand Assembly Rooms - Mrs . Fawcett , Miss I , O. Ford , the Dean of Peterborough ( chair ) 8.0\n\" Stoneshill \" annual meeting , hostess : Mrs. Osmaston . \" Women's service to the State , \" Miss Kate Hessel , Miss N. O'Shea ( chair ) 3.0\nLimpsfield Wallasey and Wirrel - Heswall - drawing - room meet- ing - Mrs . Scoresby Rontledge , M.A. , 0. Rohde , Esq . , ( chair ) 8.0\nWest Bromwich - Library Lecture Room - Mrs. Despard , Councillor J. Wheatley ( chair ) 8.0\nEccles - Worsley Court House \" Church League for The Women's Suffrage \" - The Lady Beatrice Kemp , Miss A. Maude Royden 8.0\nHassocks - Hassocks Hall - The Lady Willoughby de Broke , T. A. Meates , Esq . , J.P. ( chair ) 7.30\nFEBRUARY 28 .\nCamberley - Drill Hall - Sweated Industries Exhibi- tion , 2.30 . Speeches - Miss A. Maude Royden , J. Cameron Grant , Esq .\nCamberley - Drill Hall - Lantern Lecture on Sweated Industries - J . J. Mallon , Esq . , Mrs. Basset ( chair )\nPortsmouth - Drayton Road Schools - Rev . E. Piggott , Mrs. Lapthorn ( chair )\nWorthing - 31 , Warwick Street - Miss Carr's and Miss Pember's \" At Home \" - Assistants and Sweating \" -Miss Nicholas\nFEBRUARY 29 .\nMarple Bridge - Congregational Hall - Debate- Miss D. Darlington v . Miss Cordelia Moir\nYork - Assembly Rooms - Annual meeting - Miss I. O. Ford\nOundle - The Club Hall - Lady Frances Balfour , Sir J. Cockburn , K.C.M.G. , R. K. Bevington , Esq .\nHaywards Heath - Public Hall - Sweated Industries Exhibition - Address by Miss Mary E. Phillips - Opener , The Lady Willoughby de Broke Lantern lecture by H. Evans , Esq . 2.30-6.30\nMARCH 1 .\nJarrow - Miss Battersby Lecture Hall- \" W.S. in other lands \" -Miss Margaret Mein\nKeswick - The Club Hall - Lady Frances Balfour , Sir J. Cockburn , K.C.M.G. , R. K. Bevington , Esq .\nKnutsford - Lostock Gralam - Mrs . Cooper ( Nelson ) , Mrs. J. R. Tomlinson ( chair )\nMelton Mowbray - Corn Exchange - Mrs . Fawcett , Mrs. Renton , Rev. E. Beresford ( chair )\nMARCH 4 .\nShildon Oxford - Nottingham Birmingham\nMARCH 5 .\nBristol",
    "TableSpan": [
        {
            "Column": 2,
            "Page": 9,
            "Scan": 4
        },
        {
            "Column": 2,
            "Page": 10,
            "Scan": 5
        },
        {
            "Column": 1,
            "Page": 11,
            "Scan": 6
        },
        {
            "Column": 2,
            "Page": 11,
            "Scan": 6
        },
        {
            "Column": 1,
            "Page": 12,
            "Scan": 7
        },
        {
            "Column": 2,
            "Page": 12,
            "Scan": 7
        },
        {
            "Column": 1,
            "Page": 13,
            "Scan": 8
        },
        {
            "Column": 2,
            "Page": 13,
            "Scan": 8
        },
        {
            "Column": 1,
            "Page": 14,
            "Scan": 8
        },
        {
            "Column": 2,
            "Page": 14,
            "Scan": 8
        },
        {
            "Column": 1,
            "Page": 15,
            "Scan": 9
        },
        {
            "Column": 2,
            "Page": 15,
            "Scan": 9
        }
    ]
}