{
    "IssueDate": "1911-10-19",
    "Meetings": [
        {
            "Date": "October 19",
            "Location": "Downing Street Co-operative Hall, Manchester",
            "Raw": "Manchester - Downing Street Co - operative Hall - J . E. Sutton , Esq . , M.P. , Miss Robertson .",
            "Speakers": [
                "J. E. Sutton",
                "Miss Robertson"
            ],
            "Time": null
        },
        {
            "Date": "October 19",
            "Location": "Watts' Picture Gallery, Compton (near Guildford)",
            "Raw": "Compton ( near Guildford ) -Watts ' Picture Gallery - The Earl of Lytton , Professor Urwick , the Viscountess Midleton ( chair ) . Tea ( kindly provided by Mrs . G. F. Watts . )",
            "Speakers": [
                "The Earl of Lytton",
                "Professor Urwick"
            ],
            "Time": "4.30"
        },
        {
            "Date": "October 19",
            "Location": "Borough Hall, Godalming",
            "Raw": "Godalming - Borough Hall - The Earl of Lytton , Miss D. Hunter , Hon . A. Davey ( chair ) .",
            "Speakers": [
                "The Earl of Lytton",
                "Miss D. Hunter"
            ],
            "Time": null
        },
        {
            "Date": "October 19",
            "Location": "Pembury Church School",
            "Raw": "Pembury Church School - Miss Scott , P.L.G. , Miss Dutton , the Rev. W. R. Holman ( chair ) .",
            "Speakers": [
                "Miss Scott",
                "Miss Dutton"
            ],
            "Time": null
        },
        {
            "Date": "October 19",
            "Location": "Mrs. Thompson's Meeting, Seaton Carew",
            "Raw": "Seaton Carew - Mrs . Thompson's Meeting - Miss C. M. Gordon .",
            "Speakers": [
                "Miss C. M. Gordon"
            ],
            "Time": null
        },
        {
            "Date": "October 19",
            "Location": "23, Highfield Road, Edgbaston, Birmingham",
            "Raw": "Birmingham - 23 , Highfield Road , Edgbaston - Violin recital in aid of funds - Mrs . Priestman . Tickets , 1s .",
            "Description": "Violin recital in aid of funds",
            "Time": null
        },
        {
            "Date": "October 19",
            "Location": "Mechanics' Hall, Longtown",
            "Raw": "Longtown - Mechanics ' Hall - Miss M. Norma - Smith .",
            "Speakers": [
                "Miss M. Norma-Smith"
            ],
            "Time": null
        },
        {
            "Date": "October 20",
            "Location": "Mrs. Charles's Meeting, Tynemouth",
            "Raw": "Tynemouth - Mrs . Charles's Meeting - Miss C. M. Gordon .",
            "Speakers": [
                "Miss C. M. Gordon"
            ],
            "Time": null
        },
        {
            "Date": "October 20",
            "Location": "The Downs Lecture Room, Bowdon, Altrincham",
            "Raw": "Altrincham The Downs Lecture Room , Bowdon Annual Business Meeting , 7.30 ; Open Meeting , Miss Hester Bright",
            "Speakers": [
                "Miss Hester Bright"
            ],
            "Time": "8.0"
        },
        {
            "Date": "October 20",
            "Location": "Gerrards Cross",
            "Raw": "Gerrards Cross - Mrs . Goodbody's drawing - room meeting - Chair , Miss Tanner ( Clifton ) .",
            "Time": "8.0"
        },
        {
            "Date": "October 20",
            "Location": "10, Easy Row, Birmingham",
            "Raw": "Birmingham - 10 , Easy Row - Franchise Club .",
            "Time": "8.15"
        },
        {
            "Date": "October 20",
            "Location": "Brenchley Schoolroom",
            "Raw": "Brenchley Schoolroom - Miss Dutton",
            "Speakers": [
                "Miss Dutton"
            ],
            "Time": "7.30"
        },
        {
            "Date": "October 20",
            "Location": "Assembly Rooms, Silloth",
            "Raw": "Silloth Assembly Rooms - Miss M. Norma - Smith , Rev. R. A. Humble ( Chair ) .",
            "Speakers": [
                "Miss M. Norma-Smith"
            ],
            "Time": "3.30"
        },
        {
            "Date": "October 23",
            "Location": "27, Ridley Place, Newcastle-on-Tyne",
            "Raw": "Newcastle - on - Tyne - 27 , Ridley Place - Mrs . Angus Watson's Drawing- room Meeting - Miss C. M. Gordon .",
            "Speakers": [
                "Miss C. M. Gordon"
            ],
            "Time": "3.15"
        },
        {
            "Date": "October 23",
            "Location": "Brown's Caf\u00e9, High Street, Weston-super-Mare",
            "Raw": "Weston - super - Mare - Brown's Caf\u00e9 , High Street - Annual Meeting- Mrs. Strickland , Mrs. W. C. H. Cross .",
            "Time": "8.0"
        },
        {
            "Date": "October 23",
            "Location": "Oddfellows' Hall, Crowborough",
            "Raw": "Crowborough Oddfellows ' Hall - Miss Evelyn Sharp , Lord Brassey ( chair ) .",
            "Speakers": [
                "Miss Evelyn Sharp"
            ],
            "Time": "7.30"
        },
        {
            "Date": "October 23",
            "Location": "Corn Exchange, Leighton Buzzard",
            "Raw": "Leighton Buzzard - Corn Exchange - Lord Lytton , Miss Margaret Ashton .",
            "Speakers": [
                "Lord Lytton",
                "Miss Margaret Ashton"
            ],
            "Time": "8.0"
        },
        {
            "Date": "October 23",
            "Location": "Masonic Hall, Whitehaven",
            "Raw": "Whitehaven Masonic Hall - Miss Norma - Smith , Miss C. E. Marshall",
            "Speakers": [
                "Miss Norma-Smith",
                "Miss C. E. Marshall"
            ],
            "Time": "8.0"
        }
    ],
    "RawTable": "Forthcoming Meetings ...\nOCTOBER 19 . Manchester - Downing Street Co - operative Hall - J . E. Sutton , Esq . , M.P. , Miss Robertson . Compton ( near Guildford ) -Watts ' Picture Gallery - The Earl of Lytton , Professor Urwick , the Viscountess Midleton ( chair ) . Tea ( kindly provided by Mrs . G. F. Watts . ) 4.30\nGodalming - Borough Hall - The Earl of Lytton , Miss D. Hunter , Hon . A. Davey ( chair ) .\nPembury Church School - Miss Scott , P.L.G. , Miss Dutton , the Rev. W. R. Holman ( chair ) . Seaton Carew - Mrs . Thompson's Meeting - Miss C. M. Gordon . Birmingham - 23 , Highfield Road , Edgbaston - Violin recital in aid of funds - Mrs . Priestman . Tickets , 1s . Longtown - Mechanics ' Hall - Miss M. Norma - Smith . OCTOBER 20 . Tynemouth - Mrs . Charles's Meeting - Miss C. M. Gordon . Altrincham The Downs Lecture Room , Bowdon Annual Business Meeting , 7.30 ; Open Meeting , Miss Hester Bright 8.0 Birmingham - 10 , Easy Row - Franchise Club . 8.15 7.30 3.30 3.15 8.0 7.30 5.30 8.0 , Gerrards Cross - Mrs . Goodbody's drawing - room meeting - Chair , Miss Tanner ( Clifton ) . Brenchley Schoolroom - Miss Dutton Silloth Assembly Rooms - Miss M. Norma - Smith , Rev. R. A. Humble ( Chair ) . Gordon . OCTOBER 23 . Newcastle - on - Tyne - 27 , Ridley Place - Mrs . Angus Watson's Drawing- room Meeting - Miss C. M. Gordon . Weston - super - Mare - Brown's Caf\u00e9 , High Street - Annual Meeting- Mrs. Strickland , Mrs. W. C. H. Cross . Crowborough Oddfellows ' Hall - Miss Evelyn Sharp , Lord Brassey ( chair ) . Leighton Buzzard - Corn Exchange - Lord Lytton , Miss Margaret Ashton . Whitehaven Masonic Hall - Miss Norma - Smith , Miss C. E. Marshall 7.30 OCTOBER 24 . Manchester - 85 , Deansgate Arcade - Concert . Newcastle - on - Tyne - 27 , Ridley Place - Speakers ' Class - Miss C. M. Newcastle - on - Tyne - Miss Atkinson's Drawing - room Meeting - Miss C. M. Gordon . Bristol - 111a , Whiteladies Road - Lecture on \" Sordello \" -Miss J. M. Baretti , Romsey Town Institute - Mrs . Rackham - Debate . Egremont Town Hall - Miss Norma - Smith , Miss C. E. Marshall . 7.30 OCTOBER 25 . Bristol 49 , Royal York Crescent - Working Party . Portsmouth - Albert Hall - Mrs . Fawcett , Mrs. Cooper , Countess of Selborne ( chair ) . Dover Town Hall - Miss Abadam . Shanklin - The Institute - Lady Frances Balfour , Mr. Harold Stables , Miss Aston ( chair ) . Gateshead - Co - operative Hall - Mrs . Harrison Bell , Councillor R. Elliott , J.P. ( chair ) . Letchworth - Howard Hall- \" Suffragists and the Winter \" -Miss Courtney , Miss Hope Rea . Penarth - Mrs . Carlake Thomson's Drawing - room Meeting - Miss Helen Fraser . Frizington St. Paul's School - Miss Norma - Smith , Miss C. E. Marshall . OCTOBER 26. Haltwhistle - Mechanics ' Hall - Miss C. M. Gordon . Dinas Powis - Public Hall - Miss Helen Fraser . Fareham - Portland Hall - The Lady Frances Balfour , the Countess of Selborne ( chair ) . Crowthorne - Mrs . Reid's Meeting - Mrs . Robie Uniacke , Mrs. Renton Cleator Moor - Montreal Infant School - Miss Norma - Smith , Miss C. E. Marshall . 7.30 OCTOBER 27 , Baldock Town Hall - Mrs . Rackham , Rt . Hon . Earl of Lytton , Mr. H. C. Hardy ( chair ) . Newport ( Isle of Wight ) -Medina Hall - Lady Frances Balfour , G. D. Hall , M.P. ( chair ) . Hitchin - Workman's Hall \" Education and the Need of Women in its Administration . \" - Miss Ruth Young , Miss Tuke , M.A. Barry Mrs. Gibbering Jones's Drawing - room Meeting - Miss Helen Fraser . Seascale - Mrs . Armes's Drawing - room Meeting - Miss Norma - Smith , Miss C. E. Marshal . OCTOBER 28 . St. Bees - Hodgetts Club - Miss Norma - Smith , Miss C. E. Marshall . 7.0 OCTOBER 30 . Oldham Music Room , Werneth Park - Social evening - Tickets , 9d . Bull - Oddfellows Hall - Miss Abadam . Brandon - Paget Hall - The Lady F. Balfour , Mrs. Rackham , Miss Eva Ward , Rev. Dr. Tennant ( chair ) . OCTOBER 31 . Birmingham - Cotteridge - Open - air meeting - Miss Morrison . Cardiff Mrs. Jones's Drawing - room Meeting - Miss H. Fraser . Llanishen - Public Meeting - Miss Helen Fraser . NOVEMBER 1 . Guildford - Borough Hall - Sweated Industries Exhibition - Opened by Lord Henry Bentinck , M.P. - Mrs . Pantber Reeves . 3.0 Guildford - Lantern Lecture on Sweated Industries ( Mr. Mallon ) , followed by Suffrage Speeches by Miss Reddiss ard Mrs. Pamber Reeves . Wakefield - Institute - Lord Lytton , Miss I. O. Ford . York - Assembly Rooms - Mrs . Jalland's Drawing - room Meeting- Miss Abadam . Knutsford - King's Coffee House- \" At Home \" -Miss Reddish .",
    "TableSpan": [
        {
            "Column": 1,
            "Page": 9,
            "Scan": 4
        },
        {
            "Column": 2,
            "Page": 9,
            "Scan": 4
        },
        {
            "Column": 1,
            "Page": 10,
            "Scan": 5
        },
        {
            "Column": 2,
            "Page": 10,
            "Scan": 5
        },
        {
            "Column": 1,
            "Page": 11,
            "Scan": 6
        },
        {
            "Column": 2,
            "Page": 11,
            "Scan": 6
        },
        {
            "Column": 1,
            "Page": 12,
            "Scan": 7
        },
        {
            "Column": 2,
            "Page": 12,
            "Scan": 7
        },
        {
            "Column": 1,
            "Page": 13,
            "Scan": 8
        },
        {
            "Column": 2,
            "Page": 13,
            "Scan": 8
        }
    ]
}