{
    "IssueDate": "SEPTEMBER 30 , 1909",
    "Meetings": [
        {
            "Date": "SEPTEMBER 30",
            "Location": "BASINGSTOKE, The Town Hall",
            "Raw": "BASINGSTOKE, Public Meeting, The Town Hall. Speaker, Miss N. O'Shea. 8.0",
            "Speakers": [
                "Miss N. O'Shea"
            ],
            "Time": "8.0"
        },
        {
            "Date": "SEPTEMBER 30",
            "Location": "BRIGHTON AND HOVE, Hove Town Hall",
            "Raw": "BRIGHTON AND HOVE, The First Meeting of the Season, Hove Town Hall. 3.15",
            "Description": "The First Meeting of the Season",
            "Time": "3.15"
        },
        {
            "Date": "SEPTEMBER 30",
            "Location": "Greyshott Village Hall",
            "Raw": "HASLEMERE, HINDHEAD, AND DISTRICT, Discussion, Greyshott Village Hall. Baillie-Weaver, Esq. (Men's League), \"Why Shouldn't Women Have Votes; What have Tactics got to do with it?\" Supported by Miss Edith Sutton, Col. Pennycuick, and others. 8.30",
            "Description": "Discussion. \"Why Shouldn't Women Have Votes; What have Tactics got to do with it?\"",
            "Speakers": [
                "Baillie-Weaver, Esq. (Men's League)",
                "Miss Edith Sutton",
                "Col. Pennycuick"
            ],
            "Time": "8.30"
        },
        {
            "Date": "OCTOBER 1",
            "Location": "Gaiety Theatre, Manchester",
            "Raw": "NORTH OF ENGLAND SOCIETY, First Weekly Meeting of the Season, at the Offices, 85, Deansgate Arcade. Speaker, Miss Ashton. 7.30",
            "Description": "First Weekly Meeting of the Season, at the Offices, 85, Deansgate Arcade.",
            "Speakers": [
                "Miss Ashton"
            ],
            "Time": "7.30"
        },
        {
            "Date": "OCTOBER 2",
            "Location": "GLASGOW, 58, Renfield Street",
            "Raw": "GLASGOW, Debate at the Office, 58, Renfield Street. The Limited Franchise v. Adult Suffrage. 5-0",
            "Description": "Debate at the Office. The Limited Franchise v. Adult Suffrage.",
            "Time": "5-0"
        },
        {
            "Date": "OCTOBER 4",
            "Location": "Shrewsbury",
            "Raw": "BIRMINGHAM SOCIETY (Shrewsbury), W.L.A. Meeting. Speaker, Miss E. M. Gardner, B.A. 8.0",
            "Description": "W.L.A. Meeting",
            "Speakers": [
                "Miss E. M. Gardner, B.A."
            ],
            "Time": "8.0"
        },
        {
            "Date": "OCTOBER 4",
            "Location": "Brackenhurst, Hindhead",
            "Raw": "HASLEMERE, HINDHEAD AND DISTRICT, Members' Meeting, Brackenhurst, Hindhead. 3.40",
            "Description": "Members' Meeting",
            "Time": "3.40"
        },
        {
            "Date": "OCTOBER 4",
            "Location": "Highgate",
            "Raw": "LONDON SOCIETY (Highgate), Hostess, Mrs. Garnett. Discussion of Lady McLaren's \"Women's Charter.\" 3.40",
            "Description": "Discussion of Lady McLaren's \"Women's Charter.\"",
            "Hosts": [
                "Mrs. Garnett"
            ],
            "Time": "3.40"
        },
        {
            "Date": "OCTOBER 6",
            "Location": "Public Hall, West Norwood",
            "Raw": "LONDON SOCIETY (Beckenham), Public Meeting, Public Hall, West Norwood. Chairman. Miss Abadam. Speakers, Mrs. Philip Snowden, M.P., Mr. Philip Snowden, and others. 8.30",
            "Speakers": [
                "Mrs. Philip Snowden, M.P.",
                "Mr. Philip Snowden"
            ],
            "Time": "8.30"
        },
        {
            "Date": "OCTOBER 6",
            "Location": "1, Pembroke Cottages, Edwardes Square, Kensington",
            "Raw": "SUFFRAGE ATELIER, General Meeting, 1, Pembroke Cottages, Edwardes Square, Kensington, Cartoon Club Meeting. 8.0",
            "Description": "General Meeting, Cartoon Club Meeting",
            "Time": "8.0"
        },
        {
            "Date": "OCTOBER 7",
            "Location": "County Hall, Carlisle",
            "Raw": "CUMBERLAND, Public Meeting, County Hall, Carlisle. Chairman, Miss Bardsley. Speakers, Lady Frances Balfour, Mr. Malcolm Mitchell. 2.45",
            "Speakers": [
                "Lady Frances Balfour",
                "Mr. Malcolm Mitchell"
            ],
            "Time": "2.45"
        },
        {
            "Date": "OCTOBER 8",
            "Location": "St. Andrew's Hall, Penrith",
            "Raw": "CUMBERLAND, Public Meeting, St. Andrew's Hall, Penrith. Chairman, Mrs. Crackenthorpe. Speakers, Lady Frances Balfour and Mrs. Philip Snowden. 8.0",
            "Speakers": [
                "Lady Frances Balfour",
                "Mrs. Philip Snowden"
            ],
            "Time": "8.0"
        },
        {
            "Date": "OCTOBER 8",
            "Location": "40, Shandwick Place",
            "Raw": "EDINBURGH, \"At Home,\" 40, Shandwick Place. 3.0",
            "Description": "\"At Home\"",
            "Time": "3.0"
        },
        {
            "Date": "OCTOBER 8",
            "Location": "Stretford Town Hall",
            "Raw": "NORTH OF ENGLAND SOCIETY, Public Meeting at the Stretford Town Hall. Speakers, Councillor Margaret Ashton, Miss Margaret Robertson, and others. 7.30",
            "Speakers": [
                "Councillor Margaret Ashton",
                "Miss Margaret Robertson"
            ],
            "Time": "7.30"
        },
        {
            "Date": "OCTOBER 8",
            "Location": "85, Deansgate Arcade",
            "Raw": "NORTH OF ENGLAND SOCIETY, Weekly Meeting, 85, Deansgate Arcade. 7.30",
            "Description": "Weekly Meeting",
            "Time": "7.30"
        },
        {
            "Date": "OCTOBER 11",
            "Location": "Dingwall",
            "Raw": "EDINBURGH SOCIETY (Dingwall). Speaker, Miss W. H. Lamond. 7.30",
            "Speakers": [
                "Miss W. H. Lamond"
            ],
            "Time": "7.30"
        },
        {
            "Date": "OCTOBER 11",
            "Location": "The Midland Institute",
            "Raw": "BIRMINGHAM, The Midland Institute. Speaker, Mrs. Osler. \"The History of Women's Suffrage.\" 8.0",
            "Description": "The History of Women's Suffrage",
            "Speakers": [
                "Mrs. Osler"
            ],
            "Time": "8.0"
        }
    ],
    "RawTable": "Forthcoming Meetings. SEPTEMBER 30. BASINGSTOKE, Public Meeting, The Town Hall. Speaker, Miss N. O'Shea. 8.0 BRIGHTON AND HOVE, The First Meeting of the Season, Hove Town Hall. 3.15 HASLEMERE, HINDHEAD, AND DISTRICT, Discussion, Greyshott Village Hall. Baillie-Weaver, Esq. (Men's League), \"Why Shouldn't Women Have Votes; What have Tactics got to do with it?\" Supported by Miss Edith Sutton, Col. Pennycuick, and others. 8.30 OCTOBER 1. NORTH OF ENGLAND SOCIETY, First Weekly Meeting of the Season, at the Offices, 85, Deansgate Arcade. Speaker, Miss Ashton. 7.30 Gaiety Theatre, Manchester. NEXT WEEK. Cavaliere F. Castel'ano's ITALIAN CRAND OPERA ICOMPANY. Monday TRAVIATA Tuesday ERNANI Wednesday (Matinee) FAUST Wednesday Night LUCIA DI LAMMERMOOR Thursday IL BARBIERE DI SIVIGLIA Friday CARMEN Saturday (Matinee) RIGOLETTO Saturday Night IL TROVATORE OCT. 11 - MISS HORNIMAN'S COMPANY IN \"AY ENEMY OF THE PEOPLE,\" BY IBSEN, Tel. 8048 Central. OCTOBER 2. GLASGOW, Debate at the Office, 58, Renfield Street. The Limited Franchise v. Adult Suffrage. 5-0 OCTOBER 4. BIRMINGHAM SOCIETY (Shrewsbury), W.L.A. Meeting. Speaker, Miss E. M. Gardner, B.A. 8.0 HASLEMERE, HINDHEAD AND DISTRICT, Members' Meeting, Brackenhurst, Hindhead. 3.40 LONDON SOCIETY (Highgate), Hostess, Mrs. Garnett. Discussion of Lady McLaren's \"Women's Charter.\" OCTOBER 6. LONDON SOCIETY (Beckenham), Public Meeting, Public Hall, West Norwood. Chairman. Miss Abadam. Speakers, Mrs. Philip Snowden, M.P., Mr. Philip Snowden, and others. 8.30 SUFFRAGE ATELIER, General Meeting, 1, Pembroke Cottages, Edwardes Square, Kensington, Cartoon Club Meeting. 8.0 OCTOBER 7. CUMBERLAND, Public Meeting, County Hall, Carlisle. Chairman, Miss Bardsley. Speakers, Lady Frances Balfour, Mr. Malcolm Mitchell. 2.45 OCTOBER 8. CUMBERLAND, Public Meeting, St. Andrew's Hall, Penrith. Chairman, Mrs. Crackenthorpe. Speakers, Lady Frances Balfour and Mrs. Philip Snowden. 8.0 EDINBURGH, \"At Home,\" 40, Shandwick Place. 3.0 NORTH OF ENGLAND SOCIETY, Public Meeting at the Stretford Town Hall. Speakers, Councillor Margaret Ashton, Miss Margaret Robertson, and others. 7.30 NORTH OF ENGLAND SOCIETY, Weekly Meeting, 85, Deansgate Arcade. 7.30 OCTOBER 11. EDINBURGH SOCIETY (Dingwall). Speaker, Miss W. H. Lamond. BIRMINGHAM, The Midland Institute. Speaker, Mrs. Osler. \"The History of Women's Suffrage.\" 8.0",
    "TableSpan": [
        {
            "Column": 1,
            "Page": 10,
            "Scan": 7
        },
        {
            "Column": 1,
            "Page": 11,
            "Scan": 7
        },
        {
            "Column": 0,
            "Page": 13,
            "Scan": 8
        },
        {
            "Column": 1,
            "Page": 13,
            "Scan": 8
        }
    ]
}