{
    "IssueDate": "1911-09-28",
    "Meetings": [
        {
            "Date": "September 28",
            "Location": "E. Ham: St. Barnabas' Parish Hall, Rosebery Avenue",
            "Raw": "Sept. 28.-E. Ham: St. Barnabas' Parish Hall, Rosebery Avenue, 3 p.m. Miss Haslam, Rev. C. Hinscliff.",
            "Time": "3 p.m."
        },
        {
            "Date": "September 28",
            "Location": "Leeds",
            "Raw": "September 28. Leeds Beverley Street Council School - Miss I. O. Ford, Mrs. Renton, Miss Davenport.",
            "Speakers": [
                "Miss I. O. Ford",
                "Mrs. Renton",
                "Miss Davenport"
            ]
        },
        {
            "Date": "September 28",
            "Location": "Toddington Park",
            "Raw": "Toddington Park - Mrs. Mercer's Drawing-room Meeting - The Lady Frances Balfour, Miss Dorothy Edwards, Col. Mercer (chair).",
            "Hosts": [
                "Mrs. Mercer"
            ],
            "Speakers": [
                "Lady Frances Balfour",
                "Miss Dorothy Edwards"
            ]
        },
        {
            "Date": "September 29",
            "Location": "Chorley Wood: Mrs. Findlay's Garden",
            "Raw": "Sept. 29. - Chorley Wood: Mrs. Findlay's Garden Meeting, \"Roanoke,\" Station Road, 3-15. Mrs. Robinson (Watford), Rev. C. Hinscliff.",
            "Time": "3-15 p.m."
        },
        {
            "Date": "September 29",
            "Location": "Leeds: Armley Temperance Hall, Wesley Road",
            "Raw": "September 29. Leeds - Armley Temperance Hall, Wesley Road - Miss I. O. Ford, Mrs. Renton, Miss Davenport.",
            "Speakers": [
                "Miss I. O. Ford",
                "Mrs. Renton",
                "Miss Davenport"
            ]
        },
        {
            "Date": "September 29",
            "Location": "Birmingham - 10, Easy Row",
            "Raw": "Birmingham - 10, Easy Row - Franchise Club.",
            "Description": "Franchise Club"
        },
        {
            "Date": "September 29",
            "Location": "Barnard Castle - Witham Hall",
            "Raw": "Barnard Castle - Witham Hall - Miss Helen Fraser.",
            "Speakers": [
                "Miss Helen Fraser"
            ]
        },
        {
            "Date": "September 29",
            "Location": "Sheffield Gleadless Road Infant School",
            "Raw": "Sheffield Gleadless Road Infant School - Meeting of Women Teachers Mrs. Sinclair, Mrs. Beeny.",
            "Description": "Meeting of Women Teachers",
            "Speakers": [
                "Mrs. Sinclair",
                "Mrs. Beeny"
            ],
            "Time": "7.30 p.m."
        },
        {
            "Date": "September 30",
            "Location": "Letchworth",
            "Raw": "September 30. Letchworth. 3.30 Afternoon",
            "Time": "3.30 p.m."
        },
        {
            "Date": "October 2",
            "Location": "Bournemouth - Prince's Hall (Grand Hotel)",
            "Raw": "October 2. Bournemouth - Prince's Hall (Grand Hotel) -The Lady Frances Balfour.",
            "Speakers": [
                "Lady Frances Balfour"
            ]
        },
        {
            "Date": "October 2",
            "Location": "Colwyn Bay - Caf\u00e9 Royal",
            "Raw": "Colwyn Bay - Caf\u00e9 Royal - Miss Macpherson, Dr. Lilian Blake (chair).",
            "Speakers": [
                "Miss Macpherson"
            ]
        },
        {
            "Date": "October 2",
            "Location": "Sheffield - Montgomery Hall",
            "Raw": "Sheffield - Montgomery Hall - Mrs. Philip Snowden, Dr. Helen Wilson (chair).",
            "Speakers": [
                "Mrs. Philip Snowden"
            ]
        },
        {
            "Date": "October 2",
            "Location": "Uckfield - Public Hall",
            "Raw": "Uckfield - Public Hall Lecture on Woman Suffrage - Lyon Blease, Esq., Lady Brassey (chair).",
            "Description": "Lecture on Woman Suffrage",
            "Speakers": [
                "Lyon Blease, Esq."
            ]
        },
        {
            "Date": "October 2",
            "Location": "Manchester - 5, Parkfield Road, Didsbury",
            "Raw": "Manchester Society - 5, Parkfield Road, Didsbury - Mrs. Herford's American Tea (in aid of funds).",
            "Description": "American Tea (in aid of funds)",
            "Hosts": [
                "Mrs. Herford"
            ],
            "Time": "3.30-6.0 p.m."
        },
        {
            "Date": "October 2",
            "Location": "Birmingham - Women's Adult School, George Road",
            "Raw": "Birmingham - Women's Adult School, George Road (by kind permission of Mrs. Priestman) -Mrs. Ring.",
            "Speakers": [
                "Mrs. Ring"
            ]
        },
        {
            "Date": "October 2",
            "Location": "Uxbridge - Brookfield Restaurant",
            "Raw": "Uxbridge - Brookfield Restaurant - Social Evening.",
            "Description": "Social Evening",
            "Time": "7.30-10.0 p.m."
        },
        {
            "Date": "October 2",
            "Location": "Berkhamsted - Progress Hall",
            "Raw": "Berkhamsted - Progress Hall - Mrs. Rackham.",
            "Speakers": [
                "Mrs. Rackham"
            ],
            "Time": "7.30 p.m."
        },
        {
            "Date": "October 3",
            "Location": "Central Sussex - St. John's Institute, Burgess Hill",
            "Raw": "October 3. Central Sussex - St. John's Institute, Burgess Hill - Lord Robert Cecil, K.C., The Countess Brassey (chair).",
            "Speakers": [
                "Lord Robert Cecil"
            ],
            "Time": "8.15 p.m."
        },
        {
            "Date": "October 3",
            "Location": "Manchester - Albert Hall",
            "Raw": "Public Meeting In the Albert Hall, Manchester, Tuesday, October 3rd, AT EIGHT P.M., TO PROTEST AGAINST THE ABOLITION OF THE WORK OF WOMEN AT THE PITBROWS, And to Demand the Franchise. SPEAKERS THE MAYOR AND MAYORESS OF WIGAN. MRS. NANCY DISLEY (Pitbrow Worker) MRS. ELIZA NEAL (Pitbrow Worker) MISS KING MAY MISS REDDISH MISS GORE-BOOTH MRS. DICKENSON MISS ROPER.",
            "Description": "To protest against the abolition of the work of women at the pitbrows, and to demand the franchise.",
            "Speakers": [
                "The Mayor and Mayoress of Wigan",
                "Mrs. Nancy Disley",
                "Mrs. Eliza Neal",
                "Miss King-May",
                "Miss Reddish",
                "Miss Gore-Booth",
                "Mrs. Dickenson",
                "Miss Roper"
            ],
            "Time": "8 p.m."
        },
        {
            "Date": "October 3",
            "Location": "Birmingham - Smethwick Town Hall",
            "Raw": "Birmingham - Smethwick Town Hall - Miss A. Maude Royden, 8.0 Mrs. Ring, Fred Hughes, Esq. (chair).",
            "Speakers": [
                "Miss A. Maude Royden",
                "Mrs. Ring"
            ],
            "Time": "8 p.m."
        },
        {
            "Date": "October 3",
            "Location": "Solihull - Norfolk House, Dorridge",
            "Raw": "Solihull Society - Norfolk House, Dorridge Mrs. Snushall's Drawing-room Meeting - Miss A. Maude Royden.",
            "Hosts": [
                "Mrs. Snushall"
            ],
            "Speakers": [
                "Miss A. Maude Royden"
            ],
            "Time": "3 p.m."
        },
        {
            "Date": "October 3",
            "Location": "Hove",
            "Raw": "Hove Miss Bryan's Drawing-room Meeting to Hove Council Teachers - Miss M. F. Basden, E. Hackforth, Esq.",
            "Description": "Drawing-room meeting to Hove Council Teachers",
            "Hosts": [
                "Miss Bryan"
            ],
            "Speakers": [
                "Miss M. F. Basden",
                "E. Hackforth, Esq."
            ]
        },
        {
            "Date": "October 3",
            "Location": "Gorton Town Hall",
            "Raw": "Gorton Town Hall - Public Meeting.",
            "Description": "Public Meeting",
            "Time": "7:30 p.m."
        }
    ],
    "RawTable": "Forthcoming Meetings\nHoward Park Joint Demonstration - N.U. Speakers: Miss Abadam, J. Clayton, Esq., and others.\nBirmingham - Smethwick Town Hall - Miss A. Maude Royden, 8.0 Mrs. Ring, Fred Hughes, Esq. (chair).\nSolihull Society - Norfolk House, Dorridge Mrs. Snushall's Drawing-room Meeting - Miss A. Maude Royden. 3.0\nHove Miss Bryan's Drawing-room Meeting to Hove Council Teachers - Miss M. F. Basden, E. Hackforth, Esq.\nGorton Town Hall - Public Meeting. SEPTEMBER 28. \nLeeds Beverley Street Council School - Miss I. O. Ford, Mrs. Renton, Miss Davenport.\nToddington Park - Mrs. Mercer's Drawing-room Meeting - The Lady Frances Balfour, Miss Dorothy Edwards, Col. Mercer (chair).\nSEPTEMBER 29.\nLeeds - Armley Temperance Hall, Wesley Road - Miss I. O. Ford, Mrs. Renton, Miss Davenport.\nBirmingham - 10, Easy Row - Franchise Club.\nBarnard Castle - Witham Hall - Miss Helen Fraser.\nSheffield Gleadless Road Infant School - Meeting of Women Teachers Mrs. Sinclair, Mrs. Beeny. 7.30\nSEPTEMBER 30. Letchworth. 3.30 Afternoon\nOCTOBER 2. Bournemouth - Prince's Hall (Grand Hotel) -The Lady Frances Balfour.\nColwyn Bay - Caf\u00e9 Royal - Miss Macpherson, Dr. Lilian Blake (chair).\nSheffield - Montgomery Hall - Mrs. Philip Snowden, Dr. Helen Wilson (chair).\nUckfield - Public Hall Lecture on Woman Suffrage - Lyon Blease, Esq., Lady Brassey (chair).\nManchester Society - 5, Parkfield Road, Didsbury - Mrs. Herford's American Tea (in aid of funds). 3.30-6.0\nBirmingham - Women's Adult School, George Road (by kind permission of Mrs. Priestman) -Mrs. Ring.\nUxbridge - Brookfield Restaurant - Social Evening. 7.30-10.0\nBerkhamsted - Progress Hall - Mrs. Rackham. 7.30\nOCTOBER 3. Central Sussex - St. John's Institute, Burgess Hill - Lord Robert Cecil, K.C., The Countess Brassey (chair). 8.15\nOCTOBER 4. Bristol 46, College Road - Working Party.\nNewcastle-on-Tyne - 27, Ridley Place - Teachers' \"At Home.\" 3.0\nWest Bromwich Town Hall Mrs. Philip Snowden, The Mayor (chair). 8.0\nSudbury, Suffolk - Town Hall - Mr. Mirrlees, Miss Eva Ward, Mrs. Salmon (chair). 3.30\nOCTOBER 5. Bristol - 5, Berkeley Square - Cake, Jam and Sweet Sale. 11-1.30 and 3-8\nLeamington - Birch's Music Rooms - Warwick and Leamington Franchise Club. 3.0\nStocksfield Mrs. Parmley Graham's Meeting - Mrs. Lewis. 4.0\nOCTOBER 6. Birmingham - St. Mary's Vicarage, Bearwood - Mrs. Wynne's Drawing-room meeting - Miss L. R. Taylor, Mrs. Ring. 3.0\nOCTOBER 7. Birmingham - Warley Woods Men's Liberal Association- Council Schools, Barclay Road - Mrs. Osler. 8.0\nOCTOBER 9. Birmingham - Midland Institute, Paradise Street - H. N. Brailsford, Esq., Councillor Freeman (chair). (In conjunction with the W.S.P.U.) 8.0\nSolihull and District - Henley-in-Arden Institute - Miss Frances Sterling, Miss Morrison, Lady Willoughby de Broke (chair). 8.0\nUckfield - Public Hall - Lecture on Woman Suffrage - Miss Abadam, F. Buxton, Esq. (chair). 8.0\nOCTOBER 10. Newcastle-on-Tyne - 27, Ridley Place - Speakers' Class - Miss C. M. Gordon. 8.0\nSolihull - Public Hall - Miss Frances Sterling, Mrs. Osler, The Hon. Mrs. Basil Hanbury (chair). 8.0\nOCTOBER 11. Solihull and District - Hampton-in-Arden - Mrs. Nash's Drawing-room Meeting - Miss Sterling, Miss Morrison. 3.0\nSolihull and District Shirley Institute - Miss Burd's \"At Home\" Miss Frances Sterling. Recitations by Miss Ruth Nightingale. 8.0\nBristol - 7, Osborne Road - Working Party. 3.0",
    "TableSpan": [
        {
            "Column": 2,
            "Page": 11,
            "Scan": 6
        },
        {
            "Column": 1,
            "Page": 13,
            "Scan": 7
        },
        {
            "Column": 2,
            "Page": 13,
            "Scan": 7
        },
        {
            "Column": 1,
            "Page": 14,
            "Scan": 8
        },
        {
            "Column": 2,
            "Page": 14,
            "Scan": 8
        },
        {
            "Column": 1,
            "Page": 15,
            "Scan": 8
        },
        {
            "Column": 2,
            "Page": 15,
            "Scan": 8
        }
    ]
}