{
    "IssueDate": "1912-05-02",
    "Meetings": [
        {
            "Date": "MAY 2",
            "Location": "Leamington - Birch's Music Rooms, Parade",
            "Raw": "MAY 2 Leamington - Birch's Music Rooms, Parade and Leamington Franchise Club 3.0",
            "Speakers": [
                "Miss Lewis"
            ],
            "Time": "3.0"
        },
        {
            "Date": "MAY 2",
            "Location": "Swansea - Mrs. Lewis's drawing-room meeting",
            "Raw": "Swansea - Mrs. Lewis's drawing - room meet- ing - Miss Helen Fraser",
            "Speakers": [
                "Miss Helen Fraser"
            ]
        },
        {
            "Date": "MAY 2",
            "Location": "Swansea - Albert Hall - Lecture",
            "Raw": "Swansea - Albert Hall - Lecture - Miss Helen Fraser , Miss Dillwy ( chair )",
            "Speakers": [
                "Miss Helen Fraser",
                "Miss Dillwy"
            ],
            "Time": "8.0"
        },
        {
            "Date": "MAY 2",
            "Location": "Wallsend - Co-operative Hall",
            "Raw": "Wallsend - Co - operative Hall - Mrs. Philip Snowden",
            "Speakers": [
                "Mrs. Philip Snowden"
            ],
            "Time": "7.30"
        },
        {
            "Date": "MAY 2",
            "Location": "Leighton Buzzard - Assembly Room",
            "Raw": "Leighton Buzzard - Assembly Room - The Lady Balfour , Dr. Pearson ( chair )",
            "Speakers": [
                "The Lady Balfour",
                "Dr. Pearson"
            ],
            "Time": "8.0"
        },
        {
            "Date": "MAY 3",
            "Location": "Stockton-on-Tees - Borough Hall",
            "Raw": "MAY 3 . Stockton - on - Tees - Borough Hall Mrs. Philip Snowden , Miss Lucas",
            "Speakers": [
                "Mrs. Philip Snowden",
                "Miss Lucas"
            ],
            "Time": "8.0"
        },
        {
            "Date": "MAY 3",
            "Location": "Newcastle-on-Tyne - 27, Ridley Place",
            "Raw": "Newcastle - on - Tyne - 27 , Ridley Place White tea and sale",
            "Time": "4.30"
        },
        {
            "Date": "MAY 3",
            "Location": "Newbridge - Mrs. Atkinson's \"At Home\"",
            "Raw": "Newbridge - Mrs. Atkinson's \"At Home\" - Miss Noel Wright",
            "Speakers": [
                "Miss Noel Wright"
            ],
            "Time": "3.30"
        },
        {
            "Date": "MAY 3",
            "Location": "Wolverhampton - Mrs. F. D. Taylor's \"At Home\"",
            "Raw": "Wolverhampton - Mrs. F. D. Taylor's \"At Home\" -Miss Timpany , B.A.",
            "Speakers": [
                "Miss Timpany"
            ],
            "Time": "7.0"
        },
        {
            "Date": "MAY 4",
            "Location": "Horsham - Town Hall",
            "Raw": "MAY 4 . Horsham - Town Hall Members ' meeting - Mrs. Parkes on \"Tax Resistance\"",
            "Speakers": [
                "Mrs. Parkes"
            ],
            "Time": "3.15"
        },
        {
            "Date": "MAY 4",
            "Location": "Nottingham - Office, 54, Long Row",
            "Raw": "Nottingham - Office , 54 , Long Row - Whist drive , 6d . admission",
            "Description": "Whist drive",
            "Time": "7.30"
        },
        {
            "Date": "MAY 4",
            "Location": "Letchworth - Brightcot",
            "Raw": "Letchworth - Brightcot Mrs. Rackham",
            "Speakers": [
                "Mrs. Rackham"
            ]
        },
        {
            "Date": "MAY 4",
            "Location": "Letchworth - Odsey Grange",
            "Raw": "Letchworth - Odsey Grange Miss Helen Fraser",
            "Speakers": [
                "Miss Helen Fraser"
            ]
        },
        {
            "Date": "MAY 4",
            "Location": "Bristol - 111a, Whiteladies' Road",
            "Raw": "Bristol - 111a , Whiteladies ' Road- \"At Home\" - Miss Helen Fraser",
            "Description": "\"At Home\"",
            "Speakers": [
                "Miss Helen Fraser"
            ]
        },
        {
            "Date": "MAY 4",
            "Location": "Bristol - Mrs. Pease's drawing-room meeting",
            "Raw": "Bristol - Mrs. Pease's drawing - room meeting - Miss Helen Fraser , Rev. Canon Talbot , D.D. ( chair )",
            "Speakers": [
                "Miss Helen Fraser",
                "Rev. Canon Talbot"
            ],
            "Time": "3.0"
        },
        {
            "Date": "MAY 4",
            "Location": "Birmingham - 29, George Road, Edgbaston",
            "Raw": "Birmingham - 29 , George Road , Edgbaston - Mrs. Ring 's meeting for Hospital Nurses- Miss Matters",
            "Speakers": [
                "Mrs. Ring",
                "Miss Matters"
            ],
            "Time": "8.0"
        },
        {
            "Date": "MAY 4",
            "Location": "Knebworth - Mission Room",
            "Raw": "Knebworth - Mission Room - Miss Plowden",
            "Speakers": [
                "Miss Plowden"
            ],
            "Time": "3.30"
        },
        {
            "Date": "MAY 4",
            "Location": "Croydon - The Arcade, High Street",
            "Raw": "Croydon The Arcade , High Street- \"The Protection of the Girl\" - Mrs. Harris",
            "Description": "\"The Protection of the Girl\"",
            "Speakers": [
                "Mrs. Harris"
            ]
        }
    ],
    "RawTable": "Forthcoming Meetings BY THE NATIONAL UNION . ( The meetings are given only a fortnight in advance . ) MAY 2 Leamington - Birch's Music Rooms , Parade and Leamington Franchise Club 3.0 Swansea - Mrs. Lewis's drawing - room meet- ing - Miss Helen Fraser Swansea - Albert Hall - Lecture - Miss Helen Fraser , Miss Dillwy ( chair ) 8.0 Wallsend - Co - operative Hall - Mrs. Philip Snowden 7.30 Leighton Buzzard - Assembly Room - The Lady Balfour , Dr. Pearson ( chair ) 8.0 MAY 3 . Stockton - on - Tees - Borough Hall Mrs. Philip Snowden , Miss Lucas 8.0 Newcastle - on - Tyne - 27 , Ridley Place White tea and sale 4.30 Newbridge - Mrs. Atkinson's \"At Home\" - Miss Noel Wright 3.30 Wolverhampton - Mrs. F. D. Taylor's \"At Home\" -Miss Timpany , B.A. 7.0 MAY 4 . Horsham - Town Hall Members ' meeting - Mrs. Parkes on \"Tax Resistance \" 3.15 Nottingham - Office , 54 , Long Row - Whist drive , 6d . admission 7.30 Letchworth - Brightcot Mrs. Rackham Letchworth - Odsey Grange Miss Helen Fraser Bristol - 111a , Whiteladies ' Road- \"At Home\" - Miss Helen Fraser Bristol - Mrs. Pease's drawing - room meeting - Miss Helen Fraser , Rev. Canon Talbot , D.D. ( chair ) 3.0 Birmingham - 29 , George Road , Edgbaston - Mrs. Ring 's meeting for Hospital Nurses- Miss Matters 8.0 Knebworth - Mission Room - Miss Plowden 3.30 Croydon The Arcade , High Street- \"The Protection of the Girl\" - Mrs. Harris MAY 7 . Huddersfield - 60 , West Parade Miss Harrop's drawing - room meeting - Miss Clarkson , Mrs. Siddon ( chair ) . Birkenhead - Y.M.C.A. Hall - Miss Abadam , Miss Dora Mason , M.A. , Councillor T. Bulley , J.P. ( chair ) Newcastle - on - Tyne - 27 , Ridley Place - Suffrage choir practice , conducted by Mrs. Bellas Brockham Green - Miss N. Raffles - Newcastle - on - Tyne - 27 , Ridley Place - Shop assis- tants ' meeting - Miss Helen Fraser Bristol - Waggon Works Open - air meeting - Miss Fraser dinner hour East Bristol . - Moorfields Schoolroom - Mrs. Duncan Harris , Miss O'Shea , Mrs. Auerbach ( chair ) Seaford - Assembly Hall Frances de la MAY 8 . New Milton - Pagoda Tea Rooms - Mrs. Rowe 4.30 Evening Staple Hill Council School Hall - Miss Helen Fraser Coventry - Corn Exchange - Mrs. F. T. Swanwick , Manville , Esq . ( chair ) 8.0 MAY 9 . New Milton - Pagoda tea rooms \"Some Economic Aspects of Women's Enfranchisement\" - Mrs. Heitland 3.0 MAY 10 . Newcastle - on - Tyne - 27 , Ridley Place White Elephant Sale 9.30 Clifton -- Victoria Rooms - Miss Helen Fraser 3.15 Birmingham - 10 , Easy Row - Franchise Club 8.0 Darlington Temperance Institute Annual meeting Gateshead - Bewick Hall- Alice in Ganderland Address by Miss M. A. Temperley , M.A. , Miss Foley ( chair ) 7.90 Birkenhead Mrs. B. Stanley Clarke's drawing - room meeting - Miss Margaret Ashton , Mrs. Stanger ( chair ) 4.30 MAY 11 . Gateshead - P. M. Schoolroom , Ely St. - Jumble Sale 7.30 MAY 13 . Birmingham - Whitford , Bromsgrove - Miss Green's meeting for members - Miss Noel Wright 8.0 Nottingham - Office , 54 , Long Row- \"At Home\" - \"A Woman's Work\" -Miss Hastie MAY 14 . Newcastle - on - Tyne - 27 , Ridley Place Suffrage choir practice , conducted by Mrs. Bellas Simpson 8.0 East Bristol - outside boot factory - open - air meeting -Miss Helen Fraser dinner hour MAY 15 . Hove Town Hall- \"At Home\" - \"Women's Work in Poor Law Administration\" -Mrs. Rackham Bristol - Mrs. Senington's drawing - room meeting- Miss Helen Fraser Bristol - Bethe - da Schoolroom - Miss Helen Fraser , Rev. Canon Talbot , D.D. ( chair ) 3.0 New Milton - Pagoda tea rooms \"Some Economic Aspects of Women's Enfranchisement\" - Mrs. Heitland 8.0 MEETINGS ADDRESSED BY MEMBERS OF THE UNION . MAY 5 . Birmingham - Hospital Street Men's Adult School R 8.15 MAY 8 . Bristol - Women's Guild , Goulter Street - Miss Helen Fraser MAY 13 . Bristol - Moorfield - meeting of teachers - Miss Helen Fraser MAY 14 . Bow Church Institute , Newby Place , Poplar- Women's Diocesan Association- Debate Miss Frances Sterling v . Mrs. Harold Norris SCOTLAND . MAY 2 . Edinburgh - Bath Street Hall - Miss Alice Low , Miss Rosaline Masson , Miss Lisa Gordon ( chair ) 8.0 Edinburgh - 40 , Place Mortality\" - Dr. Alice Hutchison Low 4.50 MAY 3 . Ayr Y.M.C.A. rooms - members ' meeting Aberdeen - Castlegate - Open - air meeting Crompton , M.A. , Miss Shandwick 8.0 MAY 8 . Kirkcaldy Beveridge Hall - Miss Alice Low MAY 9 . Dalkeith Glencairn - Mrs. Somerville's drawing - room meeting - Miss Alice Low 3.15 MAY 10 . Alloa - Public Hall - Dr. Elsie Inglis IRELAND . MAY 4 . Dublin - 33 , Molesworth Street - Irish Government Association meeting LONDON . MAY 2 . Southwark Corner of Wansey Street and Walworth Road - Open - air meeting - Miss H. D. Cockle , Miss Gloyn 8.0 Islington - Miss Bisset Smith's drawing - room meet- ing - Mrs. G. F. Abbott 8.0 Southwark - corner of New Street and Kennington Park Road - open - air meeting - Miss Helen Ward , Miss Goddard 8.0 MAY 7 . S. Kensington -36 , Eardley Crescent , S.W. Lecture , \"Travels in the Gold Coast Colony\" - Mrs. Mary Gaunt , tickets 2s . 3.0 Blackheath - Blackheath Chambers - Annual meet- ing , 7.30 . Social evening 8.0 Kensington - Empress Rooms , Royal Palace Hotel -The Lady Frances Balfour , Miss C. D. Corbett , B.A. , Miss . M. Robert- son , B.A. , Miss Helen Ward ( chair ) 3.30 North Paddington - 11 , Landerdale Parade , Maida Vale - Social - Speaker , Mrs. Rogers 8.15 MAY 8 . Ealing - Buol's Cafe Restaurant - Mrs. C. J. Hamilton , Professor de Sumichrast 3.15 Southwark - corner of Falmouth Road and New Kent Road - Miss Ruth Young , Miss D. Brown 8.0 Walworth Mrs. J. Osborn's drawing - room meeting 8.0 MAY 9 . Clapham Road - Upper Schoolroom , Claylands Road \"Sons of Temperance\" Mrs. Rogers 8.30 Southwark - corner of Searles Road and New Kent Road - open - air meeting - Miss H. D. Cockle , Mrs. Merivale Mayer 8.0 MAY 10 . New Cross - Corner of Pepys Road , New Cross Gate -Open - air meeting - Mrs. Rogers , Miss D. Brown 8.0 Ealing - W.L.A. - Miss Helen Ward 3.0 Southwark - Corner of Surrey Square and Old Kent Road - Open - air meeting - Miss W. G. Rinder 8.0 MAY 13 . Southwark - 24 , Newington Causeway - Miss Rinder 8.0 Westoliff - Crowstone Gymnasium , Northview Drive -The Lady Frances Balfour , T. A. Rose Esq . ( chair ) 8.30 MAY 14 . Southwark Corner of Liverpool Street and Wal- worth Road - Open - air meeting - Miss Goddard 3.30 Kensington - Empress Rooms , Royal Palace Hotel- The Lady Frances Balfour , Mrs. Fawcett , Miss Emily Hill , P.L.G. , Miss E. Palliser ( chair ) 8.0",
    "TableSpan": [
        {
            "Column": 2,
            "Page": 9,
            "Scan": 5
        },
        {
            "Column": 2,
            "Page": 11,
            "Scan": 7
        },
        {
            "Column": 1,
            "Page": 12,
            "Scan": 7
        },
        {
            "Column": 2,
            "Page": 12,
            "Scan": 7
        },
        {
            "Column": 1,
            "Page": 13,
            "Scan": 8
        },
        {
            "Column": 2,
            "Page": 13,
            "Scan": 8
        },
        {
            "Column": 1,
            "Page": 14,
            "Scan": 8
        },
        {
            "Column": 2,
            "Page": 14,
            "Scan": 8
        }
    ]
}