{
    "IssueDate": "1910-08-18",
    "Meetings": [
        {
            "Date": "August 18",
            "Location": "Hayward's Heath",
            "Raw": "Hayward's Heath - Garden Meeting - Miss Margaret Ashton, Miss Duncan",
            "Speakers": [
                "Miss Margaret Ashton",
                "Miss Duncan"
            ],
            "Time": null
        },
        {
            "Date": "August 20",
            "Location": "Black Rock House, Linthwaite, Huddersfield",
            "Raw": "Huddersfield - Black Rock House, Linthwaite - Garden Party- Miss Fielden : 3.30",
            "Speakers": [
                "Miss Fielden"
            ],
            "Time": "3:30"
        },
        {
            "Date": "August 20",
            "Location": "Highgate, London",
            "Raw": "London (Highgate) -Open - air Meeting.",
            "Time": null
        },
        {
            "Date": "August 20",
            "Location": "Guildford",
            "Raw": "Guildford - Open - air Meeting - Miss Margaret Ashton, Sir William Chance",
            "Speakers": [
                "Miss Margaret Ashton",
                "Sir William Chance"
            ],
            "Time": "8:00"
        },
        {
            "Date": "August 21",
            "Location": "Beeston Park, Leeds",
            "Raw": "Leeds Beeston Park - Miss I. O. Ford, Miss Fielden",
            "Speakers": [
                "Miss I. O. Ford",
                "Miss Fielden"
            ],
            "Time": null
        },
        {
            "Date": "August 22",
            "Location": "East Ward, Leeds",
            "Raw": "Leeds Women's Labour League - East Ward - Miss Fielden .",
            "Speakers": [
                "Miss Fielden"
            ],
            "Time": "11:00 a.m."
        },
        {
            "Date": "August 23",
            "Location": "Cuckfield",
            "Raw": "Cuckfield Society - Miss Margaret Ashton",
            "Speakers": [
                "Miss Margaret Ashton"
            ],
            "Time": null
        },
        {
            "Date": "August 23",
            "Location": "Crondall, Farnham",
            "Raw": "Farnham - Crondall - Open - air Meeting - Miss Barbara Duncan",
            "Speakers": [
                "Miss Barbara Duncan"
            ],
            "Time": "3:00"
        },
        {
            "Date": "August 24",
            "Location": "Adel Grange, Leeds",
            "Raw": "Leeds The Misses Ford's Garden Party - Adel Grange",
            "Time": null
        },
        {
            "Date": "August 24",
            "Location": "Cuckfield",
            "Raw": "Cuckfield Society - Miss Margaret Ashton",
            "Speakers": [
                "Miss Margaret Ashton"
            ],
            "Time": null
        },
        {
            "Date": "August 25",
            "Location": "Tilford, Farnham",
            "Raw": "Farnham - Tilford - Open - air Meeting - Miss Barbara Duncan .",
            "Speakers": [
                "Miss Barbara Duncan"
            ],
            "Time": null
        },
        {
            "Date": "August 26",
            "Location": "Kingston Market Place, London",
            "Raw": "London - Kingston Market Place Open - air Meeting - Miss Dawson",
            "Speakers": [
                "Miss Dawson"
            ],
            "Time": "8:00"
        },
        {
            "Date": "August 26",
            "Location": "Frensham, Farnham",
            "Raw": "Farnham - Frensham - Open - air Meeting - Miss Barbara Duncan",
            "Speakers": [
                "Miss Barbara Duncan"
            ],
            "Time": "8.0"
        },
        {
            "Date": "August 27",
            "Location": "Farsley, Leeds",
            "Raw": "Leeds Garden Party - Farsley - Miss Fielden",
            "Speakers": [
                "Miss Fielden"
            ],
            "Time": null
        },
        {
            "Date": "August 27",
            "Location": "Highgate, London",
            "Raw": "London - Highgate - Open - air Meeting",
            "Time": "8:00"
        },
        {
            "Date": "August 29",
            "Location": "Grove Road Schoolroom, Windsor, London",
            "Raw": "London Windsor - Grove Road Schoolroom - At Home .",
            "Time": "8:00"
        },
        {
            "Date": "September 1",
            "Location": "Women's Co-operative Guild, Enfield, London",
            "Raw": "London Enfield - Women's Co - operative Guild - Miss Rinder",
            "Speakers": [
                "Miss Rinder"
            ],
            "Time": null
        },
        {
            "Date": "September 3",
            "Location": "Highgate, London",
            "Raw": "London - Highgate - Open - air Meeting",
            "Time": "8:00"
        },
        {
            "Date": "September 10",
            "Location": "Highgate, London",
            "Raw": "London - Highgate - Open - air Meeting",
            "Time": "8:00"
        },
        {
            "Date": "September 24",
            "Location": "Highgate, London",
            "Raw": "London - Highgate - Open - air Meeting .",
            "Time": "8:00"
        },
        {
            "Date": "September 26",
            "Location": "Highgate, London",
            "Raw": "London - Highgate - Annual Meeting Lantern Lecture Miss Bertha Mason",
            "Speakers": [
                "Miss Bertha Mason"
            ],
            "Time": "8:00"
        }
    ],
    "RawTable": "Forthcoming Meetings\nAUGUST 18 . Hayward's Heath - Garden Meeting - Miss Margaret Ashton , Miss Duncan .\nAUGUST 20 . Huddersfield - Black Rock House , Linthwaite - Garden Party- Miss Fielden : 3.30 London ( Highgate ) -Open - air Meeting . Guildford - Open - air Meeting - Miss Margaret Ashton , Sir William 8.0 Chance .\nAUGUST 21 . Leeds Beeston Park - Miss I. O. Ford , Miss Fielden .\nAUGUST 22 . 11 a.m. Leeds Women's Labour League - East Ward - Miss Fielden . Cuckfield Society - Miss Margaret Ashton . Cuckfield Society - Miss Margaret Ashton . Farnham - Crondall - Open - air Meeting - Miss Barbara Duncan .\nAUGUST 24 . 3.0 AUGUST 23 . Leeds The Misses Ford's Garden Party - Adel Grange . Cuckfield Society - Miss Margaret Ashton .\nAUGUST 25 . Farnham - Tilford - Open - air Meeting - Miss Barbara Duncan .\nAUGUST 26 . London - Kingston Market Place Open - air Meeting - Miss Dawson . 8.0 Farnham - Frensham - Open - air Meeting - Miss Barbara Duncan .\nAUGUST 27 . Leeds Garden Party - Farsley - Miss Fielden . London - Highgate - Open - air Meeting . 8.0\nAUGUST 29 . London Windsor - Grove Road Schoolroom - At Home . 8.0\nSEPTEMBER 1 London Enfield - Women's Co - operative Guild - Miss Rinder .\nSEPTEMBER 3 .. London - Highgate - Open - air Meeting .\nSEPTEMBER 10 . 8.0 8.0 8.0 Meeting Lantern Lecture Miss 8.0 London - Highgate - Open - air Meeting .\nSEPTEMBER 24 . London - Highgate - Open - air Meeting .\nSEPTEMBER 26 . London - Highgate - Annual Bertha Mason",
    "TableSpan": [
        {
            "Column": 2,
            "Page": 14,
            "Scan": 8
        },
        {
            "Column": 2,
            "Page": 15,
            "Scan": 9
        }
    ]
}